{
  "$schema": "./site.schema.json",
  "siteTitle": "Board",
  "siteUrl": "https://ml8.sharepoint.com/sites/Board",
  "template": "document-hub",
  "heroImage": {
    "file": "assets/board-hero.jpg",
    "alt": "The Sydney skyline and Sydney Tower at dusk"
  },
  "accentColor": "#153E64",
  "heroCta": {
    "label": "View board papers",
    "url": "BoardPapers"
  },
  "page": {
    "name": "Board-Home",
    "title": "Board",
    "summary": "Finalised board papers, approved minutes and governing documents. Drafts belong in Board – WIP.",
    "description": "The Board site holds the finalised record for the Moonlight Resources board of directors. Board Papers contains the agendas and papers circulated ahead of each meeting, Meeting Minutes holds the approved record once a meeting has concluded, and Policies and Charters covers the board's own governing documents (charters, terms of reference, delegations of authority). Only finalised, board-approved material belongs here — drafts and works in progress live on the Board – WIP site instead."
  },
  "libraries": [
    {
      "title": "Board Papers",
      "url": "BoardPapers",
      "description": "Board meeting papers and agendas"
    },
    {
      "title": "Meeting Minutes",
      "url": "MeetingMinutes",
      "description": "Approved board meeting minutes"
    },
    {
      "title": "Policies and Charters",
      "url": "PoliciesCharters",
      "description": "Board charters and governance policies"
    }
  ],
  "quickLinks": [
    {
      "label": "Board papers",
      "url": "BoardPapers"
    },
    {
      "label": "Meeting minutes",
      "url": "MeetingMinutes"
    },
    {
      "label": "Policies and charters",
      "url": "PoliciesCharters"
    }
  ],
  "importantDates": []
}
