{
  "$schema": "./site.schema.json",
  "siteTitle": "Subsidiaries",
  "siteUrl": "https://ml8.sharepoint.com/sites/Subsidiaries",
  "template": "document-hub",
  "heroImage": {
    "file": "assets/subsidiaries-hero.jpg",
    "alt": "Sydney Harbour Bridge and Opera House lit up at night"
  },
  "accentColor": "#153E64",
  "heroCta": {
    "label": "View subsidiary records",
    "url": "SubsidiaryRecords"
  },
  "page": {
    "name": "Subsidiaries-Home",
    "title": "Subsidiaries",
    "summary": "Entity records and statutory documents for the Moonlight Resources group.",
    "description": "The Subsidiaries site is the corporate record for Moonlight Resources' group structure. Subsidiary Records holds entity-level information for each subsidiary (directors, shareholdings, key contacts), and Corporate Documents covers incorporation certificates, constitutions and other statutory filings. This is the reference point for understanding how the corporate group fits together, not the operational records of the subsidiaries themselves."
  },
  "libraries": [
    {
      "title": "Subsidiary Records",
      "url": "SubsidiaryRecords",
      "description": "Corporate records for subsidiary entities"
    },
    {
      "title": "Corporate Documents",
      "url": "CorporateDocuments",
      "description": "Incorporation and statutory documents"
    }
  ],
  "quickLinks": [
    {
      "label": "Subsidiary records",
      "url": "SubsidiaryRecords"
    },
    {
      "label": "Corporate documents",
      "url": "CorporateDocuments"
    }
  ],
  "importantDates": []
}
