{
  "$schema": "./site.schema.json",
  "siteTitle": "Board – WIP",
  "siteUrl": "https://ml8.sharepoint.com/sites/boardwip",
  "template": "document-hub",
  "heroImage": {
    "file": "assets/board-wip-hero.jpg",
    "alt": "A hand signing a document with a pen, close up in black and white"
  },
  "accentColor": "#153E64",
  "heroCta": {
    "label": "View draft papers",
    "url": "DraftPapers"
  },
  "page": {
    "name": "Board-WIP-Home",
    "title": "Board – WIP",
    "summary": "Prepare and review board papers here. Move finalised, approved material to the Board site.",
    "description": "Board – WIP is the working space for board material that isn't ready for the boardroom yet. Draft Papers holds board papers still being written or reviewed, and Working Documents covers the supporting analysis, data and correspondence behind them. Once a paper is finalised and approved, it moves across to the main Board site — nothing here should be treated as the approved record."
  },
  "libraries": [
    {
      "title": "Draft Papers",
      "url": "DraftPapers",
      "description": "Board papers in draft"
    },
    {
      "title": "Working Documents",
      "url": "WorkingDocuments",
      "description": "Supporting working documents"
    }
  ],
  "quickLinks": [
    {
      "label": "Draft papers",
      "url": "DraftPapers"
    },
    {
      "label": "Working documents",
      "url": "WorkingDocuments"
    }
  ],
  "importantDates": []
}
