{
  "$schema": "./site.schema.json",
  "siteTitle": "Legal",
  "siteUrl": "https://ml8.sharepoint.com/sites/Legal",
  "template": "document-hub",
  "heroImage": {
    "file": "assets/legal-hero.jpg",
    "alt": "A bronze Lady Justice statue holding scales and a sword"
  },
  "accentColor": "#153E64",
  "heroCta": {
    "label": "View contracts",
    "url": "Contracts"
  },
  "page": {
    "name": "Legal-Home",
    "title": "Legal",
    "summary": "Contracts, compliance records and legal correspondence in one reference point.",
    "description": "The Legal site holds Moonlight Resources' contractual and regulatory record. Contracts covers executed agreements (suppliers, tenements, joint ventures), Compliance Documents tracks obligations under the Corporations Act, mining legislation and other regulatory regimes, and Legal Correspondence holds formal legal advice and correspondence with external counsel. Treat this as the authoritative source before assuming what a contract or obligation actually says."
  },
  "libraries": [
    {
      "title": "Contracts",
      "url": "Contracts",
      "description": "Executed contracts and agreements"
    },
    {
      "title": "Compliance Documents",
      "url": "ComplianceDocuments",
      "description": "Regulatory and compliance records"
    },
    {
      "title": "Legal Correspondence",
      "url": "LegalCorrespondence",
      "description": "Legal correspondence and advice"
    }
  ],
  "quickLinks": [
    {
      "label": "Contracts",
      "url": "Contracts"
    },
    {
      "label": "Compliance documents",
      "url": "ComplianceDocuments"
    },
    {
      "label": "Legal correspondence",
      "url": "LegalCorrespondence"
    }
  ],
  "importantDates": []
}
