{
  "$schema": "./site.schema.json",
  "siteTitle": "Corporate Governance",
  "siteUrl": "https://ml8.sharepoint.com/sites/CorporateGovernance",
  "template": "document-hub",
  "heroImage": {
    "file": "assets/corporate-governance-hero.jpg",
    "alt": "A close-up of a small brass balance scale, evenly weighted"
  },
  "accentColor": "#4D6299",
  "heroCta": {
    "label": "View governance policies",
    "url": "GovernancePolicies"
  },
  "page": {
    "name": "Corporate-Governance-Home",
    "title": "Corporate Governance",
    "summary": "Company-wide policies, board and committee charters, and compliance records.",
    "description": "Corporate Governance is where Moonlight Resources' overarching governance framework lives, separate from the Board's own meeting-specific papers. As an ASX-listed company (ASX: ML8), Moonlight Resources operates under the ASX Listing Rules and the Corporations Act. Governance Policies covers company-wide governance policies (e.g. continuous disclosure, risk management), Charters and Terms of Reference holds the constitutions of the board and its committees, and Compliance Documents tracks those regulatory obligations directly. This is the reference point for how the company is governed, not just what the board decided."
  },
  "libraries": [
    {
      "title": "Governance Policies",
      "url": "GovernancePolicies",
      "description": "Approved governance policies"
    },
    {
      "title": "Charters and Terms of Reference",
      "url": "Charters",
      "description": "Board and committee charters"
    },
    {
      "title": "Compliance Documents",
      "url": "ComplianceDocuments",
      "description": "Regulatory and compliance records"
    }
  ],
  "quickLinks": [
    {
      "label": "Governance policies",
      "url": "GovernancePolicies"
    },
    {
      "label": "Charters and terms of reference",
      "url": "Charters"
    },
    {
      "label": "Compliance documents",
      "url": "ComplianceDocuments"
    }
  ],
  "importantDates": []
}
