{
  "$schema": "./site.schema.json",
  "siteTitle": "Human Resources",
  "siteUrl": "https://ml8.sharepoint.com/sites/HumanResources",
  "template": "landing-page",
  "heroImage": {
    "file": "assets/human-resources-hero.jpg",
    "alt": "A diverse team in a meeting room, with a facilitator writing on a whiteboard"
  },
  "accentColor": "#4D6299",
  "page": {
    "name": "Human-Resources-Home",
    "title": "Human Resources",
    "summary": "Forms, people documents and workplace policies for employees and managers.",
    "description": "The Human Resources site is where the Moonlight Resources team goes for people-related support. HR Documents covers forms, templates and general people paperwork, and Policies and Procedures sets out what's expected of employees and managers alike — from leave and conduct through to workplace health and safety. If you have a question about how something people-related is meant to work, start here."
  },
  "libraries": [
    {
      "title": "HR Documents",
      "url": "HRDocuments",
      "description": "General HR documents and forms"
    },
    {
      "title": "Policies and Procedures",
      "url": "PoliciesProcedures",
      "description": "HR policies and procedures"
    }
  ],
  "quickLinks": [
    {
      "label": "HR documents",
      "url": "HRDocuments"
    },
    {
      "label": "Policies and procedures",
      "url": "PoliciesProcedures"
    }
  ],
  "importantDates": []
}
