{
  "$schema": "./site.schema.json",
  "siteTitle": "Administration",
  "siteUrl": "https://ml8.sharepoint.com/sites/Administrator",
  "template": "landing-page",
  "heroImage": {
    "file": "assets/administration-hero.jpg",
    "alt": "A tidy desk with a keyboard, blank notepad and pen"
  },
  "accentColor": "#153E64",
  "page": {
    "name": "Administration-Home",
    "title": "Administration",
    "summary": "Everyday documents, approved procedures and reusable templates for the team.",
    "description": "The Administration site is the shared home base for day-to-day operations at Moonlight Resources. General Documents holds the paperwork that doesn't have a more specific home, Policies and Procedures is the source of truth for how things are done, and Templates gives you a starting point instead of formatting from scratch. If you're not sure where something belongs company-wide, it probably starts here."
  },
  "libraries": [
    {
      "title": "General Documents",
      "url": "GeneralDocuments",
      "description": "General administrative documents"
    },
    {
      "title": "Policies and Procedures",
      "url": "PoliciesProcedures",
      "description": "Approved corporate policies and procedures"
    },
    {
      "title": "Templates",
      "url": "Templates",
      "description": "Reusable document and form templates"
    }
  ],
  "quickLinks": [
    {
      "label": "General documents",
      "url": "GeneralDocuments"
    },
    {
      "label": "Policies and procedures",
      "url": "PoliciesProcedures"
    },
    {
      "label": "Templates",
      "url": "Templates"
    }
  ],
  "importantDates": []
}
