{
  "$schema": "./site.schema.json",
  "siteTitle": "Finance",
  "siteUrl": "https://ml8.sharepoint.com/sites/Finance",
  "template": "document-hub",
  "heroImage": {
    "file": "assets/finance-hero.jpg",
    "alt": "A financial chart with multiple colored trend lines on a monitor"
  },
  "accentColor": "#153E64",
  "heroCta": {
    "label": "View financial reports",
    "url": "FinancialReports"
  },
  "page": {
    "name": "Finance-Home",
    "title": "Finance",
    "summary": "Management reports, budgets and forecasts to support planning and financial decisions.",
    "description": "The Finance site supports the day-to-day work of running Moonlight Resources' finance function. Financial Reports holds management and statutory reporting, Budgets and Forecasts covers the numbers the business plans against, and Policies and Procedures sets out the finance controls the team operates under. This complements Accounting & Audit — Finance is where the numbers are prepared and analysed; Accounting & Audit is where the audited record sits."
  },
  "libraries": [
    {
      "title": "Financial Reports",
      "url": "FinancialReports",
      "description": "Management and statutory financial reports"
    },
    {
      "title": "Budgets and Forecasts",
      "url": "BudgetsForecasts",
      "description": "Budgets, forecasts and working papers"
    },
    {
      "title": "Policies and Procedures",
      "url": "PoliciesProcedures",
      "description": "Finance policies and procedures"
    }
  ],
  "quickLinks": [
    {
      "label": "Financial reports",
      "url": "FinancialReports"
    },
    {
      "label": "Budgets and forecasts",
      "url": "BudgetsForecasts"
    },
    {
      "label": "Policies and procedures",
      "url": "PoliciesProcedures"
    }
  ],
  "importantDates": []
}
