{
  "$schema": "./site.schema.json",
  "siteTitle": "Accounting & Audit",
  "siteUrl": "https://ml8.sharepoint.com/sites/accounting",
  "template": "document-hub",
  "heroImage": {
    "file": "assets/accounting-audit-hero.jpg",
    "alt": "Uluru glowing red at sunrise across the outback"
  },
  "accentColor": "#4D6299",
  "heroCta": {
    "label": "View accounting documents",
    "url": "AccountingDocuments"
  },
  "page": {
    "name": "Accounting-Audit-Home",
    "title": "Accounting & Audit",
    "summary": "Financial records, audit evidence and the policies behind accurate reporting.",
    "description": "The Accounting & Audit site is the record of truth for Moonlight Resources' financial reporting. Use Accounting Documents for day-to-day ledgers and working papers, Audit Documents for internal and external audit evidence, and Policies and Procedures for the finance controls everyone is expected to follow. Keep this site current — it's what auditors and the finance team rely on at year-end."
  },
  "libraries": [
    {
      "title": "Accounting Documents",
      "url": "AccountingDocuments",
      "description": "Accounting records and working documents"
    },
    {
      "title": "Audit Documents",
      "url": "AuditDocuments",
      "description": "Internal and external audit documentation"
    },
    {
      "title": "Policies and Procedures",
      "url": "PoliciesProcedures",
      "description": "Approved finance policies and procedures"
    }
  ],
  "quickLinks": [
    {
      "label": "Accounting documents",
      "url": "AccountingDocuments"
    },
    {
      "label": "Audit documents",
      "url": "AuditDocuments"
    },
    {
      "label": "Policies and procedures",
      "url": "PoliciesProcedures"
    }
  ],
  "importantDates": [
    "Financial year-end",
    "Audit timetable",
    "Tax lodgement dates"
  ]
}
