{
  "$schema": "./site.schema.json",
  "siteTitle": "Shareholders",
  "siteUrl": "https://ml8.sharepoint.com/sites/Shareholders",
  "template": "document-hub",
  "heroImage": {
    "file": "assets/shareholders-hero.jpg",
    "alt": "Two people in business attire shaking hands"
  },
  "accentColor": "#4D6299",
  "heroCta": {
    "label": "View shareholder communications",
    "url": "ShareholderCommunications"
  },
  "page": {
    "name": "Shareholders-Home",
    "title": "Shareholders",
    "summary": "Shareholder communications and registry forms. Public market disclosures are on Investor Relations.",
    "description": "The Shareholders site supports the team handling day-to-day shareholder administration for Moonlight Resources. Shareholder Communications holds notices, letters and other correspondence sent to shareholders, and Forms covers the registry-related paperwork shareholders are asked to complete (e.g. change of address, dividend instructions). For public market disclosures, see the Investor Relations site instead — this one is about servicing existing shareholders directly."
  },
  "libraries": [
    {
      "title": "Shareholder Communications",
      "url": "ShareholderCommunications",
      "description": "Notices and communications to shareholders"
    },
    {
      "title": "Forms",
      "url": "Forms",
      "description": "Shareholder forms and templates"
    }
  ],
  "quickLinks": [
    {
      "label": "Shareholder communications",
      "url": "ShareholderCommunications"
    },
    {
      "label": "Forms",
      "url": "Forms"
    }
  ],
  "importantDates": []
}
