{
  "$schema": "./site.schema.json",
  "siteTitle": "Investor Relations",
  "siteUrl": "https://ml8.sharepoint.com/sites/IR",
  "template": "document-hub",
  "heroImage": {
    "file": "assets/investor-relations-hero.jpg",
    "alt": "A digital stock ticker display showing a share price and an upward trend line"
  },
  "accentColor": "#4D6299",
  "heroCta": {
    "label": "View ASX announcements",
    "url": "ASXAnnouncements"
  },
  "page": {
    "name": "Investor-Relations-Home",
    "title": "Investor Relations",
    "summary": "Published market announcements, investor presentations and company reports. Only publicly disclosed material belongs here.",
    "description": "Investor Relations holds everything Moonlight Resources (ASX: ML8) has disclosed to the market and to shareholders since listing in December 2025. ML8 is focused on gold and REE-uranium discoveries, with its flagship Clermont Gold Project in Queensland and the MacDonnell Ranges REE-uranium project in the Northern Territory. ASX Announcements is the authoritative record of market disclosures under the ASX Listing Rules, Investor Presentations covers materials prepared for investors and analysts (roadshows, briefings), and Annual Reports holds the annual and half-year reporting suite. Anything published here should already be public — this is a mirror of disclosed information, not a place for material that hasn't cleared continuous disclosure obligations."
  },
  "libraries": [
    {
      "title": "ASX Announcements",
      "url": "ASXAnnouncements",
      "description": "Market announcements and disclosures"
    },
    {
      "title": "Investor Presentations",
      "url": "InvestorPresentations",
      "description": "Investor and analyst presentations"
    },
    {
      "title": "Annual Reports",
      "url": "AnnualReports",
      "description": "Annual and half-year reports"
    }
  ],
  "quickLinks": [
    {
      "label": "ASX announcements",
      "url": "ASXAnnouncements"
    },
    {
      "label": "Investor presentations",
      "url": "InvestorPresentations"
    },
    {
      "label": "Annual reports",
      "url": "AnnualReports"
    }
  ],
  "importantDates": []
}
